{
  "$schema": "./schemas/package.schema.json",
  "name": "hetzner-vps",
  "template": "hetzner-vps",
  "templateVersion": "0.1.0",
  "configuration": {},
  "deployments": [
    {
      "name": "prod",
      "hetznerUser": "max",
      "awsRegion": "us-west-2",
      "awsUser": "goldstack-dev",
      "configuration": {
        "location": "hil",
        "serverType": "cpx11",
        "sshUserFingerprint": "73:db:08:81:7f:fe:34:c3:40:2e:10:d0:89:a7:b7:12",
        "serverName": "goldstack-docker",
        "onlyAllowSshAccessFromIp": "210.50.200.68",
        "environmentVariables": [
          {
            "name": "DUMMY_ENV",
            "value": "I rock"
          },
          {
            "name": "HTTP_PORT",
            "value": "80"
          },
          {
            "name": "HTTPS_PORT",
            "value": "443"
          }
        ]
      },
      "tfStateKey": "hetzner-docker-prod-c7e278526542d31fcdec.tfstate"
    }
  ]
}
